mysql> use my_db;
Database changed
mysql> create table employee
    -> (
    -> eid int not null auto_increment primary key,
    -> ename varchar(40),
    -> address varchar(40)
    -> );
ERROR 1050 (42S01): Table 'employee' already exists
mysql> create table employee1
    -> (
    -> eid int not null auto_increment primary key,
    -> ename varchar(40),
    -> address varchar(40)
    -> );
Query OK, 0 rows affected (0.01 sec)

mysql> desc employee1;
+---------+-------------+------+-----+---------+----------------+
| Field   | Type        | Null | Key | Default | Extra          |
+---------+-------------+------+-----+---------+----------------+
| eid     | int         | NO   | PRI | NULL    | auto_increment |
| ename   | varchar(40) | YES  |     | NULL    |                |
| address | varchar(40) | YES  |     | NULL    |                |
+---------+-------------+------+-----+---------+----------------+
3 rows in set (0.00 sec)

mysql> create table department
    -> (
    -> did not null auto_increment primary key,
    -> dname varchar(40),
    -> empid int not null,
    -> foreign key (empid) references employee(eid);
ERROR 1064 (42000): You have an error in your SQL syntax; check the manual that corresponds to your MySQL server version for the right syntax to use near 'not null auto_increment primary key,
dname varchar(40),
empid int not null,
fore' at line 3
mysql> create table department
    -> (
    -> did not null auto_increment primary key,
    -> dname varchar(40),
    -> empid int not null
    -> foreign key(empid) references employee(eid)
    -> );
ERROR 1064 (42000): You have an error in your SQL syntax; check the manual that corresponds to your MySQL server version for the right syntax to use near 'not null auto_increment primary key,
dname varchar(40),
empid int not null
forei' at line 3
mysql> create table department
    -> (
    -> did not null auto_increment primary key,
    -> dname varchar(40),
    -> empid int not null,
    -> foreign key(empid) references employee(eid)
    -> );
ERROR 1064 (42000): You have an error in your SQL syntax; check the manual that corresponds to your MySQL server version for the right syntax to use near 'not null auto_increment primary key,
dname varchar(40),
empid int not null,
fore' at line 3
mysql> create table department
    -> (
    -> did int not null auto_increment primary key,
    -> dname varchar(40),
    -> empid int not null,
    -> foreign key(empid) references employee(eid)
    -> );
ERROR 1050 (42S01): Table 'department' already exists
mysql> create table department1
    -> (
    -> did int not null auto_increment primary key,
    -> dname varchar(40),
    -> empid int not null,
    -> foreign key(empid) references employee(eid)
    -> );
ERROR 3734 (HY000): Failed to add the foreign key constraint. Missing column 'eid' for constraint 'department1_ibfk_1' in the referenced table 'employee'
mysql> create table department1
    -> (
    -> did int not null auto_increment primary key,
    -> dname varchar(40),
    -> empid int not null,
    -> foreign key(empid) references employee1(eid)
    -> );
Query OK, 0 rows affected (0.03 sec)

mysql> desc department1;
+-------+-------------+------+-----+---------+----------------+
| Field | Type        | Null | Key | Default | Extra          |
+-------+-------------+------+-----+---------+----------------+
| did   | int         | NO   | PRI | NULL    | auto_increment |
| dname | varchar(40) | YES  |     | NULL    |                |
| empid | int         | NO   | MUL | NULL    |                |
+-------+-------------+------+-----+---------+----------------+
3 rows in set (0.00 sec)

mysql> select * from information_schema.table_constraints
    -> where table_name='department';
Empty set (0.00 sec)

mysql> create table department2
    -> (
    -> did int not null auto_increment primary key,
    -> dname varchar(40),
    -> empid int not null,
    -> constraint employee_eid_fk
    -> foreign key(empid) references employee1(eid)
    -> );
Query OK, 0 rows affected (0.03 sec)

mysql> select * from information_schema.table_constraints
    -> where table name='department1');
ERROR 1064 (42000): You have an error in your SQL syntax; check the manual that corresponds to your MySQL server version for the right syntax to use near 'table name='department1')' at line 2
mysql> select * from information_schema.table_constraints
    -> where table_name='department1';
+--------------------+-------------------+--------------------+--------------+-------------+-----------------+----------+
| CONSTRAINT_CATALOG | CONSTRAINT_SCHEMA | CONSTRAINT_NAME    | TABLE_SCHEMA | TABLE_NAME  | CONSTRAINT_TYPE | ENFORCED |
+--------------------+-------------------+--------------------+--------------+-------------+-----------------+----------+
| def                | my_db             | PRIMARY            | my_db        | department1 | PRIMARY KEY     | YES      |
| def                | my_db             | department1_ibfk_1 | my_db        | department1 | FOREIGN KEY     | YES      |
+--------------------+-------------------+--------------------+--------------+-------------+-----------------+----------+
2 rows in set (0.00 sec)

mysql> select * from information_schema.table_constraints
    -> where table_name='department2';
+--------------------+-------------------+-----------------+--------------+-------------+-----------------+----------+
| CONSTRAINT_CATALOG | CONSTRAINT_SCHEMA | CONSTRAINT_NAME | TABLE_SCHEMA | TABLE_NAME  | CONSTRAINT_TYPE | ENFORCED |
+--------------------+-------------------+-----------------+--------------+-------------+-----------------+----------+
| def                | my_db             | PRIMARY         | my_db        | department2 | PRIMARY KEY     | YES      |
| def                | my_db             | employee_eid_fk | my_db        | department2 | FOREIGN KEY     | YES      |
+--------------------+-------------------+-----------------+--------------+-------------+-----------------+----------+
2 rows in set (0.00 sec)

mysql> alter table department1
    -> add constraint department1_name_fk
    -> foreign key(dname) refernces employee1(ename);
ERROR 1064 (42000): You have an error in your SQL syntax; check the manual that corresponds to your MySQL server version for the right syntax to use near 'refernces employee1(ename)' at line 3
mysql> alter table department1
    -> add constraint department1_name_fk
    -> foreign key(dname) references employee1(ename);
ERROR 1822 (HY000): Failed to add the foreign key constraint. Missing index for constraint 'department1_name_fk' in the referenced table 'employee1'
mysql> alter table department1
    -> add constraint employee1_eid_fk
    -> foreign key(empid) references employee1(eid);
Query OK, 0 rows affected (0.05 sec)
Records: 0  Duplicates: 0  Warnings: 0

mysql> desc department1
    -> ^C
mysql> desc department1;
+-------+-------------+------+-----+---------+----------------+
| Field | Type        | Null | Key | Default | Extra          |
+-------+-------------+------+-----+---------+----------------+
| did   | int         | NO   | PRI | NULL    | auto_increment |
| dname | varchar(40) | YES  |     | NULL    |                |
| empid | int         | NO   | MUL | NULL    |                |
+-------+-------------+------+-----+---------+----------------+
3 rows in set (0.00 sec)

mysql> select * from information_schema.table_constraints
    -> where table_name='department1';
+--------------------+-------------------+--------------------+--------------+-------------+-----------------+----------+
| CONSTRAINT_CATALOG | CONSTRAINT_SCHEMA | CONSTRAINT_NAME    | TABLE_SCHEMA | TABLE_NAME  | CONSTRAINT_TYPE | ENFORCED |
+--------------------+-------------------+--------------------+--------------+-------------+-----------------+----------+
| def                | my_db             | PRIMARY            | my_db        | department1 | PRIMARY KEY     | YES      |
| def                | my_db             | department1_ibfk_1 | my_db        | department1 | FOREIGN KEY     | YES      |
| def                | my_db             | employee1_eid_fk   | my_db        | department1 | FOREIGN KEY     | YES      |
+--------------------+-------------------+--------------------+--------------+-------------+-----------------+----------+
3 rows in set (0.00 sec)

mysql> insert table employee1
    ->
    -> ^C
mysql> desc employee1;
+---------+-------------+------+-----+---------+----------------+
| Field   | Type        | Null | Key | Default | Extra          |
+---------+-------------+------+-----+---------+----------------+
| eid     | int         | NO   | PRI | NULL    | auto_increment |
| ename   | varchar(40) | YES  |     | NULL    |                |
| address | varchar(40) | YES  |     | NULL    |                |
+---------+-------------+------+-----+---------+----------------+
3 rows in set (0.00 sec)

mysql> insert into employee1 (ename,address) values('pia','delhi'),
    -> ('tushi','chennai'),
    -> ('raja','bangalore'),
    -> ('rani',''mumbai');
    '>
    '> ^C
mysql> insert into employee1 (ename,address) values('pia','delhi'),
    -> ('raja','bangalore'),
    -> ('tushi','chennai'),
    -> ('rani',''mumbai')
    '> );
    '>
    '> desc employee1;
    '> desc employee1;
    '> insert into employee1 (ename,address) values('pia','delhi'),
    '> ^C
mysql> insert into employee1 (ename,address) values('pia','delhi'),
    -> ('tushi','chennai'),
    -> ('raja','bangalore'),
    -> ('rani',''mumbai')
    '> );
    '> ^C
mysql> insert into employee1 (ename,address) values('pia','delhi'),
    -> ('tushi','chennai'),
    -> ('rani',''mumbai')
    '> ('raja','bangalore');
    '>
    '>
    '>
    '>
    '> ^C
mysql> insert into employee1 (ename,address) values('pia','delhi'),
    -> ('moni','chennai'),('tushi','mumbai'),('niki','bangalore');
Query OK, 4 rows affected (0.00 sec)
Records: 4  Duplicates: 0  Warnings: 0

mysql> select * from employee1;
+-----+-------+-----------+
| eid | ename | address   |
+-----+-------+-----------+
|   1 | pia   | delhi     |
|   2 | moni  | chennai   |
|   3 | tushi | mumbai    |
|   4 | niki  | bangalore |
+-----+-------+-----------+
4 rows in set (0.00 sec)

mysql> desc department1;
+-------+-------------+------+-----+---------+----------------+
| Field | Type        | Null | Key | Default | Extra          |
+-------+-------------+------+-----+---------+----------------+
| did   | int         | NO   | PRI | NULL    | auto_increment |
| dname | varchar(40) | YES  |     | NULL    |                |
| empid | int         | NO   | MUL | NULL    |                |
+-------+-------------+------+-----+---------+----------------+
3 rows in set (0.00 sec)

mysql> insert into department (dname,empid) values('IT',1),
    -> ('hr',2),('sales',3),('hr',4),('It',1),('hr',2),
    -> ('dm',2),('sales'2);
ERROR 1064 (42000): You have an error in your SQL syntax; check the manual that corresponds to your MySQL server version for the right syntax to use near '2)' at line 3
mysql> insert into department (dname,empid) values('IT',1),
    -> ('hr',2),('sales',3),('hr',4),('It',1),('hr',2),
    -> ('dm',2),('sales',2);
ERROR 1054 (42S22): Unknown column 'dname' in 'field list'
mysql> insert into department1 (dname,empid) values('IT',1),
    -> ('hr',2),('sales',3),('hr',4),('It',1),('hr',2),
    -> ('dm',2),('sales',2);
Query OK, 8 rows affected (0.00 sec)
Records: 8  Duplicates: 0  Warnings: 0

mysql> select * from department1;
+-----+-------+-------+
| did | dname | empid |
+-----+-------+-------+
|   1 | IT    |     1 |
|   2 | hr    |     2 |
|   3 | sales |     3 |
|   4 | hr    |     4 |
|   5 | It    |     1 |
|   6 | hr    |     2 |
|   7 | dm    |     2 |
|   8 | sales |     2 |
+-----+-------+-------+
8 rows in set (0.00 sec)

mysql> drop table employee1;
ERROR 3730 (HY000): Cannot drop table 'employee1' referenced by a foreign key constraint 'employee_eid_fk' on table 'department2'.
mysql> delete from employee1
    -> ^C
mysql>
mysql> delete from department1
    -> where did =8;
Query OK, 1 row affected (0.00 sec)

mysql> select * from department1;
+-----+-------+-------+
| did | dname | empid |
+-----+-------+-------+
|   1 | IT    |     1 |
|   2 | hr    |     2 |
|   3 | sales |     3 |
|   4 | hr    |     4 |
|   5 | It    |     1 |
|   6 | hr    |     2 |
|   7 | dm    |     2 |
+-----+-------+-------+
7 rows in set (0.00 sec)

mysql> delete from deartment
    -> ^C
mysql>
mysql> delete from department1
    -> where empid=4;
Query OK, 1 row affected (0.00 sec)

mysql> select * from department1;
+-----+-------+-------+
| did | dname | empid |
+-----+-------+-------+
|   1 | IT    |     1 |
|   2 | hr    |     2 |
|   3 | sales |     3 |
|   5 | It    |     1 |
|   6 | hr    |     2 |
|   7 | dm    |     2 |
+-----+-------+-------+
6 rows in set (0.00 sec)

mysql> delete from employee1
    -> where eid=1;
ERROR 1451 (23000): Cannot delete or update a parent row: a foreign key constraint fails (`my_db`.`department1`, CONSTRAINT `department1_ibfk_1` FOREIGN KEY (`empid`) REFERENCES `employee1` (`eid`))
mysql> delete from department1
    -> where eid=1;
ERROR 1054 (42S22): Unknown column 'eid' in 'where clause'
mysql> delete from department1
    -> where empid=1;
Query OK, 2 rows affected (0.00 sec)

mysql> delete from employee1
    -> where eid=4;
Query OK, 1 row affected (0.00 sec)

mysql> select * from employee1;
+-----+-------+---------+
| eid | ename | address |
+-----+-------+---------+
|   1 | pia   | delhi   |
|   2 | moni  | chennai |
|   3 | tushi | mumbai  |
+-----+-------+---------+
3 rows in set (0.00 sec)

mysql>